{
  "commandId": "urn:srcos:op-command:sync-request-demo-0001",
  "specVersion": "0.1.0",
  "issuedAt": "2026-05-07T06:06:00Z",
  "actorRef": "urn:srcos:subject:operator-demo",
  "sessionRef": "urn:srcos:shell-session:demo-0001",
  "commandClass": "sync-request",
  "targetRef": "urn:srcos:workspace:professional-intelligence-demo",
  "payload": {
    "syncProfileRef": "urn:srcos:sync-profile:default",
    "inlineMaterialIncluded": false
  },
  "isDryRun": true,
  "policyDecisionRefs": [
    "urn:srcos:policy-decision:op-command-sync-demo-0001"
  ]
}
