{
  "commandId": "urn:srcos:op-command:turtleterm-open-demo-0001",
  "specVersion": "0.1.0",
  "issuedAt": "2026-05-07T06:05:00Z",
  "actorRef": "urn:srcos:subject:operator-demo",
  "sessionRef": "urn:srcos:shell-session:demo-0001",
  "commandClass": "turtleterm-open",
  "targetRef": "urn:srcos:workspace-op-state:admitted-syncing-demo-0001",
  "payload": {
    "profileRef": "urn:srcos:shell-profile:default",
    "inlineMaterialIncluded": false
  },
  "isDryRun": false,
  "policyDecisionRefs": [
    "urn:srcos:policy-decision:op-command-turtleterm-demo-0001"
  ]
}
